<?xml version="1.0" encoding="utf-8" ?>
<!DOCTYPE packagegui SYSTEM "./schema/packages.dtd">
<?xml-stylesheet type="text/xsl" href="./xsl/package.xsl"?>
<packagegui>
	<copyright>
	<![CDATA[
/* $Id$ */
/* ========================================================================== */
/*
    postfix_recipients.xml
    part of the Postfix package for pfSense
    Copyright (C) 2011 Marcello Coutinho
    All rights reserved.            
*/
/* ========================================================================== */
/*
    Redistribution and use in source and binary forms, with or without
    modification, are permitted provided that the following conditions are met:

     1. Redistributions of source code must retain the above copyright notice,
        this list of conditions and the following disclaimer.

     2. Redistributions in binary form must reproduce the above copyright
        notice, this list of conditions and the following disclaimer in the
        documentation and/or other materials provided with the distribution.

    THIS SOFTWARE IS PROVIDED ``AS IS'' AND ANY EXPRESS OR IMPLIED WARRANTIES,
    INCLUDING, BUT NOT LIMITED TO, THE IMPLIED WARRANTIES OF MERCHANTABILITY
    AND FITNESS FOR A PARTICULAR PURPOSE ARE DISCLAIMED. IN NO EVENT SHALL THE
    AUTHOR BE LIABLE FOR ANY DIRECT, INDIRECT, INCIDENTAL, SPECIAL, EXEMPLARY,
    OR CONSEQUENTIAL DAMAGES (INCLUDING, BUT NOT LIMITED TO, PROCUREMENT OF
    SUBSTITUTE GOODS OR SERVICES; LOSS OF USE, DATA, OR PROFITS; OR BUSINESS
    INTERRUPTION) HOWEVER CAUSED AND ON ANY THEORY OF LIABILITY, WHETHER IN
    CONTRACT, STRICT LIABILITY, OR TORT (INCLUDING NEGLIGENCE OR OTHERWISE)
    ARISING IN ANY WAY OUT OF THE USE OF THIS SOFTWARE, EVEN IF ADVISED OF THE
    POSSIBILITY OF SUCH DAMAGE.
                                                                              */
/* ========================================================================== */
	]]>
	</copyright>
	<description>Describe your package here</description>
	<requirements>Describe your package requirements here</requirements>
	<faq>Currently there are no FAQ items provided.</faq>
	<name>postfixrecipients</name>
	<version>1.0</version>
	<title>Services: Postfix relay and antispam</title>
	<include_file>/usr/local/pkg/postfix.inc</include_file>
	<menu>
		<name>Postfix Antispam and mail Relay</name>
		<tooltiptext>Configure Postfix Forwarder</tooltiptext>
		<section>Services</section>
		<url>pkg_edit.php?xml=postfix.xml&amp;id=0</url>
	</menu>
	<service>
		<name>postfix</name>
		<rcfile>postfix.sh</rcfile>
		<executable>master</executable>
	</service>
	<additional_files_needed>
		<item>http://www.pfsense.org/packages/config/postfix/postfix.inc</item>
		<prefix>/usr/local/pkg/</prefix>
		<chmod>0755</chmod>
	</additional_files_needed>
	<additional_files_needed>
		<item>http://www.pfsense.org/packages/config/postfix/postfix_acl.xml</item>
		<prefix>/usr/local/pkg/</prefix>
		<chmod>0755</chmod>
	</additional_files_needed>
	<additional_files_needed>
		<item>http://www.pfsense.org/packages/config/postfix/postfix_recipients.xml</item>
		<prefix>/usr/local/pkg/</prefix>
		<chmod>0755</chmod>
	</additional_files_needed>
	<additional_files_needed>
		<item>http://www.pfsense.org/packages/config/postfix/postfix_antispam.xml</item>
		<prefix>/usr/local/pkg/</prefix>
		<chmod>0755</chmod>
	</additional_files_needed>

		<additional_files_needed>
		<item>http://www.pfsense.org/packages/config/postfix/postfix_sync.xml</item>
		<prefix>/usr/local/pkg/</prefix>
		<chmod>0755</chmod>
	</additional_files_needed>
		<additional_files_needed>
		<item>http://www.pfsense.org/packages/config/postfix/postfix_view_config.php</item>
		<prefix>/usr/local/www/</prefix>
		<chmod>0755</chmod>
	</additional_files_needed>
	<additional_files_needed>
		<item>http://www.pfsense.org/packages/config/postfix/postfix_recipients.php</item>
		<prefix>/usr/local/www/</prefix>
		<chmod>0755</chmod>
	</additional_files_needed>
<tabs>
		<tab>
			<text>General</text>
			<url>/pkg_edit.php?xml=postfix.xml&amp;id=0</url>
		</tab>
		<tab>
			<text>ACLs / Filter Maps</text>
			<url>/pkg_edit.php?xml=postfix_acl.xml&amp;id=0</url>
		</tab>
		<tab>
			<text>Valid recipients</text>
			<url>/pkg_edit.php?xml=postfix_recipients.xml&amp;id=0</url>
			<active/>
		</tab>
		<tab>
			<text>Antispam</text>
			<url>/pkg_edit.php?xml=postfix_antispam.xml&amp;id=0</url>
		</tab>
		<tab>
			<text>XMLRPC Sync</text>
			<url>/pkg_edit.php?xml=postfix_sync.xml&amp;id=0</url>
		</tab>
		<tab>
			<text>View config files</text>
			<url>/postfix_view_config.php</url>
		</tab>
				<tab>
			<text>Search Email</text>
			<url>/postfix_search.php</url>
		</tab>
</tabs>
	<fields>
		<field>
			<name>Get Valid recipients from Active Directory</name>
			<type>listtopic</type>
		</field>
		<field>
			<fielddescr>Enable LDAP fetch</fielddescr>
			<fieldname>enable_ldap</fieldname>
			<type>checkbox</type>
			<description><![CDATA[Extract valid email addresses from Active Directory.<br>
								Before using LDAP fetch you must install p5-perl-ldap package(hint: <strong>/usr/sbin/pkg_add -r p5-perl-ldap</strong>)]]></description>
		</field>
		<field>
			<fielddescr>Frequency</fielddescr>
			<fieldname>freq</fieldname>
			<description>Wait time between each fetch HINT 30m(30 minutes), 1h(one hour), 1d(one day)</description>
			<type>input</type>
			<size>15</size>
		</field>
		<field>
			<fielddescr><![CDATA[<strong>HINTS</strong><br>Hostname:<br>dc1.mysite.com<br><br>Domain:<br>dc=mysite,dc=com<br><br>Username:<br>cn=antispam,cn=Users<br>]]></fielddescr>
			<fieldname>none</fieldname>
			<type>rowhelper</type>
			<rowhelper>
			<rowhelperfield>
				<fielddescr>Hostname</fielddescr>
				<fieldname>dc</fieldname>
				<type>input</type>
				<size>20</size>
			</rowhelperfield>
			<rowhelperfield>
				<fielddescr>Domain</fielddescr>
				<fieldname>cn</fieldname>
				<type>input</type>
				<size>22</size>
			</rowhelperfield>
			<rowhelperfield>
				<fielddescr>Username</fielddescr>
				<fieldname>username</fieldname>
				<type>input</type>
				<size>20</size>
			</rowhelperfield>
			<rowhelperfield>
				<fielddescr>Password</fielddescr>
				<fieldname>password</fieldname>
				<type>password</type>
				<size>10</size>
			</rowhelperfield>
			</rowhelper>
		</field>
		<field>
			<name>Get Valid recipients from local file</name>
			<type>listtopic</type>
		</field>
		<field>
			<fielddescr>Location</fielddescr>
			<name>location</name>
			<type>input</type>
			<size>80</size>
		</field>
		<field>
			<name>Custom Valid recipients</name>
			<type>listtopic</type>
		</field>
		<field>
			<fielddescr>Custom list</fielddescr>
			<fieldname>custom_recipients</fieldname>
			<description><![CDATA[Paste your valid recipients here, one per line. <strong>HINT user@mycompany.com OK</strong>]]></description>
			<type>textarea</type>
			<cols>60</cols>
			<rows>15</rows>
			<encoding>base64</encoding>
		</field>
	</fields>
	<custom_php_install_command>
		postfix_php_install_command();
	</custom_php_install_command>
	<custom_php_deinstall_command>
		postfix_php_deinstall_command();
	</custom_php_deinstall_command>
	<custom_php_validation_command>
		postfix_validate_input($_POST, &amp;$input_errors);
	</custom_php_validation_command>	
	<custom_php_resync_config_command>
		sync_package_postfix();
	</custom_php_resync_config_command>
</packagegui>
