<?xml version="1.0" encoding="utf-8" ?>
<!DOCTYPE packagegui SYSTEM "./schema/packages.dtd">
<?xml-stylesheet type="text/xsl" href="./xsl/package.xsl"?>
<packagegui>
	<copyright>
	<![CDATA[
/* $Id$ */
/* ========================================================================== */
/*
    postfix.xml
    part of the Postfix package for pfSense
    Copyright (C) 2010 Erik Fonnesbeck
    All rights reserved.            
                                                                  */
/* ========================================================================== */
/*
    Redistribution and use in source and binary forms, with or without
    modification, are permitted provided that the following conditions are met:

     1. Redistributions of source code must retain the above copyright notice,
        this list of conditions and the following disclaimer.

     2. Redistributions in binary form must reproduce the above copyright
        notice, this list of conditions and the following disclaimer in the
        documentation and/or other materials provided with the distribution.

    THIS SOFTWARE IS PROVIDED ``AS IS'' AND ANY EXPRESS OR IMPLIED WARRANTIES,
    INCLUDING, BUT NOT LIMITED TO, THE IMPLIED WARRANTIES OF MERCHANTABILITY
    AND FITNESS FOR A PARTICULAR PURPOSE ARE DISCLAIMED. IN NO EVENT SHALL THE
    AUTHOR BE LIABLE FOR ANY DIRECT, INDIRECT, INCIDENTAL, SPECIAL, EXEMPLARY,
    OR CONSEQUENTIAL DAMAGES (INCLUDING, BUT NOT LIMITED TO, PROCUREMENT OF
    SUBSTITUTE GOODS OR SERVICES; LOSS OF USE, DATA, OR PROFITS; OR BUSINESS
    INTERRUPTION) HOWEVER CAUSED AND ON ANY THEORY OF LIABILITY, WHETHER IN
    CONTRACT, STRICT LIABILITY, OR TORT (INCLUDING NEGLIGENCE OR OTHERWISE)
    ARISING IN ANY WAY OUT OF THE USE OF THIS SOFTWARE, EVEN IF ADVISED OF THE
    POSSIBILITY OF SUCH DAMAGE.
                                                                              */
/* ========================================================================== */
	]]>
	</copyright>
	<description>Describe your package here</description>
	<requirements>Describe your package requirements here</requirements>
	<faq>Currently there are no FAQ items provided.</faq>
	<name>postfix</name>
	<version>1.1</version>
	<title>Services: Postfix Forwarder</title>
	<include_file>/usr/local/pkg/postfix.inc</include_file>
	<menu>
		<name>Postfix Forwarder</name>
		<tooltiptext>Configure Postfix Forwarder</tooltiptext>
		<section>Services</section>
		<url>pkg_edit.php?xml=postfix.xml&amp;id=0</url>
	</menu>
	<service>
		<name>postfix</name>
		<rcfile>postfix.sh</rcfile>
		<executable>master</executable>
	</service>
	<additional_files_needed>
		<item>http://www.pfsense.org/packages/config/postfix/postfix.inc</item>
		<prefix>/usr/local/pkg/</prefix>
		<chmod>0755</chmod>
	</additional_files_needed>
	<fields>
		<field>
			<name>Posftix General Settings</name>
			<type>listtopic</type>
		</field>
		<field>
			<fielddescr>Maximum message size</fielddescr>
			<fieldname>message_size_limit</fieldname>
			<type>input</type>
			<description>
				This setting governs the largest message size that will be accepted by this mail server. Ensure you have enough space to accommodate this size, and ensure this setting matches or is lower than the destination server(s).&lt;br/&gt;Default: 10240000 (10MB).
			</description>
		</field>
		<field>
			<name>Domains to Forward</name>
			<type>listtopic</type>
		</field>
		<field>
			<fielddescr>Forwarding</fielddescr>
			<fieldname>none</fieldname>
			<type>rowhelper</type>
			<rowhelper>
			<rowhelperfield>
				<fielddescr>Domain</fielddescr>
				<fieldname>domain</fieldname>
				<description>Enter the domain here (ex: example.com)</description>
				<type>input</type>
				<size>20</size>
			</rowhelperfield>
			<rowhelperfield>
				<fielddescr>Mail Server IP</fielddescr>
				<fieldname>mailserverip</fieldname>
				<description>Enter the mail server IP to forward to here.</description>
				<type>input</type>
				<size>20</size>
			</rowhelperfield>
			</rowhelper>
		</field>
	</fields>
	<custom_php_install_command>
		postfix_php_install_command();
	</custom_php_install_command>
	<custom_php_deinstall_command>
		postfix_php_deinstall_command();
	</custom_php_deinstall_command>
	<custom_php_validation_command>
		postfix_validate_input($_POST, &amp;$input_errors);
	</custom_php_validation_command>	
	<custom_php_resync_config_command>
		sync_package_postfix();
	</custom_php_resync_config_command>
</packagegui>
