<?xml version="1.0" encoding="utf-8" ?>
<!DOCTYPE packagegui SYSTEM "../schema/packages.dtd">
<?xml-stylesheet type="text/xsl" href="./xsl/package.xsl"?>
<packagegui>
    <copyright></copyright>
    <description>Describe your package here</description>
    <requirements>Describe your package requirements here</requirements>
    <faq>Currently there are no FAQ items provided.</faq>
	<name>vnstat2</name>
	<version>1.0</version>
	<title>vnstat2</title>
	<aftersaveredirect>/pkg_edit.php?xml=vnstat2.xml&amp;id=0</aftersaveredirect>
	<include_file>/usr/local/pkg/vnstat2.inc</include_file>
	<menu>
		<name>vnstat2</name>
		<tooltiptext></tooltiptext>
		<section>Status</section>
		<url>/vnstat2</url>
	</menu>
	<additional_files_needed>
		<prefix>/usr/local/pkg/</prefix>
		<chmod>0644</chmod>
		<item>http://www.pfsense.com/packages/config/vnstat2/vnstat2.inc</item>
	</additional_files_needed>
	<additional_files_needed>
		<prefix>/usr/local/pkg/</prefix>
		<chmod>0644</chmod>
		<item>http://www.pfsense.com/packages/config/vnstat2/bin/vnstat_php_frontend-1.4.1.tar.gz</item>
	</additional_files_needed>
	<additional_files_needed>
		<prefix>/usr/local/pkg/</prefix>
		<chmod>0644</chmod>
		<item>http://www.pfsense.com/packages/config/vnstat2/bin/vnstat.conf</item>
	</additional_files_needed>
	<custom_php_resync_config_command></custom_php_resync_config_command>
	<custom_php_install_command>vnstat_install_config();</custom_php_install_command>
	<custom_php_deinstall_command>vnstat_install_deinstall();</custom_php_deinstall_command>
</packagegui>
