<?xml version="1.0" encoding="utf-8" ?>
<!DOCTYPE packagegui SYSTEM "./schema/packages.dtd">
<?xml-stylesheet type="text/xsl" href="./xsl/package.xsl"?>
<packagegui>
        <copyright>
        <![CDATA[
/* $Id$ */
/* ========================================================================== */
/*
    authng.xml
    part of pfSense (http://www.pfSense.com)
    Copyright (C) 2007 to whom it may belong
    All rights reserved.

    Based on m0n0wall (http://m0n0.ch/wall)
    Copyright (C) 2003-2006 Manuel Kasper <mk@neon1.net>.
    All rights reserved.
                                                                              */
/* ========================================================================== */
/*
    Redistribution and use in source and binary forms, with or without
    modification, are permitted provided that the following conditions are met:

     1. Redistributions of source code must retain the above copyright notice,
        this list of conditions and the following disclaimer.

     2. Redistributions in binary form must reproduce the above copyright
        notice, this list of conditions and the following disclaimer in the
        documentation and/or other materials provided with the distribution.

    THIS SOFTWARE IS PROVIDED ``AS IS'' AND ANY EXPRESS OR IMPLIED WARRANTIES,
    INCLUDING, BUT NOT LIMITED TO, THE IMPLIED WARRANTIES OF MERCHANTABILITY
    AND FITNESS FOR A PARTICULAR PURPOSE ARE DISCLAIMED. IN NO EVENT SHALL THE
    AUTHOR BE LIABLE FOR ANY DIRECT, INDIRECT, INCIDENTAL, SPECIAL, EXEMPLARY,
    OR CONSEQUENTIAL DAMAGES (INCLUDING, BUT NOT LIMITED TO, PROCUREMENT OF
    SUBSTITUTE GOODS OR SERVICES; LOSS OF USE, DATA, OR PROFITS; OR BUSINESS
    INTERRUPTION) HOWEVER CAUSED AND ON ANY THEORY OF LIABILITY, WHETHER IN
    CONTRACT, STRICT LIABILITY, OR TORT (INCLUDING NEGLIGENCE OR OTHERWISE)
    ARISING IN ANY WAY OUT OF THE USE OF THIS SOFTWARE, EVEN IF ADVISED OF THE
    POSSIBILITY OF SUCH DAMAGE.
                                                                              */
/* ========================================================================== */
        ]]>
        </copyright>
    <description>Describe your package here</description>
    <requirements>Describe your package requirements here</requirements>
    <faq>Currently there are no FAQ items provided.</faq>
	<name>upclient</name>
	<version>5.0.b8_2</version>
	<title>upclient: Settings</title>
	<aftersaveredirect>pkg_edit.php?xml=upclient.xml&amp;id=0</aftersaveredirect>
	<menu>
                <name>upclient</name>
                <tooltiptext>Modify upclient settings.</tooltiptext>
                <section>Services</section>
                <configfile>upclient.xml</configfile>
                <url>/pkg_edit.php?xml=upclient.xml&amp;id=0</url>
        </menu>
	<service>
                <name>upclient</name>
                <rcfile>upclient.sh</rcfile>
                <executable>upclient</executable>
        </service>
	<configpath>installedpackages->package->$packagename->configuration->settings</configpath>
	<fields>
		<field>
			<fielddescr>Authorization Key</fielddescr>
			<fieldname>authkey</fieldname>
			<description>This system's uptime authorization key.</description>
			<type>input</type>
		</field>
		<field>
			<fielddescr>Update Interval</fielddescr>
			<fieldname>interval</fieldname>
			<description>The interval between updates, in seconds (default 550).</description>
			<type>input</type>
		</field>
		<field>
			<fielddescr>Uptime Server</fielddescr>
			<fieldname>server</fieldname>
			<description>The server this system should send uptime reports to.</description>
			<type>input</type>
		</field>
	</fields>
	<custom_php_global_functions>
	function sync_package_upclient() {
		global $config;
                conf_mount_rw();
                config_lock();
		$upclient_conf = $config['installedpackages']['upclient']['config'][0];
		$fout = fopen("/usr/local/etc/upclient.conf", "w");
		if($upclient_conf['authkey'] and $upclient_conf['server']) {
			fwrite($fout, "PidFile = /var/run/upclient.pid # Location of pid file\n");
			fwrite($fout, "AuthKey = {$upclient_conf['authkey']}\n");
			$interval = $upclient_conf['interval'] ? $upclient_conf['interval'] : "550";
			fwrite($fout, "Interval = {$interval}\n");
			fwrite($fout, "UptimeServer = {$upclient_conf['server']}\n");
			$static = &lt;&lt;&lt;EOD
SendIdle      = 1       # Send CPU idle percent
SendUsage     = 1       # Send CPU load percent
SendOSName    = 1       # Send name of your Operating System
SendOSVersion = 1       # Send version of your OS
SendCPU       = 1       # Send CPU name of your machine
SendCPUDetail = 1       # (BSD, Linux &amp; Solaris only)
SendLoadAvg   = 1       # Send 15-minute Load-average (unix only)

EOD;
			fwrite($fout, $static);
			fclose($fout);
		}
		$start = "/usr/local/sbin/upclient &amp;";
		write_rcfile(array(
			"file" => "upclient.sh",
			"start" => $start
			)
		);
		restart_service("upclient");
                conf_mount_ro();
                config_unlock();
        }
	</custom_php_global_functions>
	<custom_add_php_command>
		sync_package_upclient();
	</custom_add_php_command>
</packagegui>

